{"declared_relation":"consistent","deltas":{"errors":0,"failures":0,"successes":0,"total":0},"findings":[],"limitations":["PLANNED_DENOMINATOR_UNKNOWN","CAUSE_UNKNOWN","SOURCE_CLAIMS_UNVERIFIED","NO_APPROVAL_AUTHORITY"],"observation_digest":"sha256:05e5fcdc7f078c6204db20714e35d73c62e80c2db5ac293e7ff64ed276f26cdb","producer_stats":{"errors":1,"failures":1,"successes":1,"total":3},"raw_hash":"sha256:adca43c9ccc1c8065f86e14ceda28b714c21216d4ee26ec5b5fdf848a44bb3c9","row_tallies":{"errors":1,"failures":1,"successes":1,"total":3},"schema":"promptfoo_accounting.v1","source":{"format":"promptfoo.eval-output","format_version":"0.123.0"}}
